{
  "_owner": "FE",
  "_provisional": false,
  "version": "0.1.0",
  "_note": "Enterable home doors (units), FE-owned. unitId = flat:<buildingInstanceId>:<doorIndex>; buildingInstanceId names the lg_midrise_flats building by its footprint centre in whole island metres (lgmf_n439_p68 = x -439, z +68), doorIndex 0 (one walk-in door per building). Exported from client/Assets/Resources/World/Island/interior_doors.json (written by tools/world/islandgen/dress.py v3_interior_doors). All six are Residences flats behind the real street doors; roomType is the interior the client streams (Resources/World/Interiors/int_<roomType>). capacity is owner plus one guest.",
  "units": [
    {
      "unitId": "flat:lgmf_n439_p68:0",
      "district": "residences",
      "tier": "flat",
      "roomType": "apartment_modern",
      "weeklyRentCents": 18000,
      "capacity": 2
    },
    {
      "unitId": "flat:lgmf_n598_p29:0",
      "district": "residences",
      "tier": "flat",
      "roomType": "apartment_modern",
      "weeklyRentCents": 18000,
      "capacity": 2
    },
    {
      "unitId": "flat:lgmf_n400_p168:0",
      "district": "residences",
      "tier": "flat",
      "roomType": "apartment_modern",
      "weeklyRentCents": 18000,
      "capacity": 2
    },
    {
      "unitId": "flat:lgmf_n507_n40:0",
      "district": "residences",
      "tier": "flat",
      "roomType": "apartment_modern",
      "weeklyRentCents": 18000,
      "capacity": 2
    },
    {
      "unitId": "flat:lgmf_n484_n59:0",
      "district": "residences",
      "tier": "flat",
      "roomType": "apartment_modern",
      "weeklyRentCents": 18000,
      "capacity": 2
    },
    {
      "unitId": "flat:lgmf_n714_n130:0",
      "district": "residences",
      "tier": "flat",
      "roomType": "apartment_modern",
      "weeklyRentCents": 18000,
      "capacity": 2
    }
  ]
}
